生产厂商:ID,:LABEL,name
25714,生产厂商,陕西立众金叶滴眼剂
25715,生产厂商,广西十万山制药陈香露白露片
25716,生产厂商,金诃藏药益肝活血明目丸
25717,生产厂商,可意蹄甲多肽片
25718,生产厂商,南阳普康醋酸地塞米松片
25719,生产厂商,南国药业盐酸吗啉胍片
25720,生产厂商,白云山制药总厂奋乃静片
25721,生产厂商,上海通用药业黄体酮注射液
25722,生产厂商,润弘制药硫酸奈替米星注射液
25723,生产厂商,海南锦瑞制药注射用克林霉素
25724,生产厂商,大同五洲通注射用甲磺酸帕珠
25725,生产厂商,亚东生物消炎退热颗粒
25726,生产厂商,东北制药维生素C咀嚼片
25727,生产厂商,晶珠藏药十五味萝蒂明目丸
25728,生产厂商,济民可信山禾三磷酸腺苷二钠
25729,生产厂商,华澳药业十滴水
25730,生产厂商,司邦得蒙脱石散
25731,生产厂商,洛阳君山五子衍宗丸
25732,生产厂商,山西云鹏制药盐酸普萘洛尔片
25733,生产厂商,浙江经纬复方猴头颗粒
25734,生产厂商,山西同达盐酸二氧丙嗪颗粒
25735,生产厂商,怡开
25736,生产厂商,正清制药达那唑胶囊
25737,生产厂商,风度
25738,生产厂商,陕西华山碳酸氢钠注射液
25739,生产厂商,华润紫竹药业复方樟柳碱注射
25740,生产厂商,陕西盘龙三黄片
25741,生产厂商,恒瑞医药丙戊酸钠片
25742,生产厂商,浙江瑞新注射用盐酸米托蒽醌
25743,生产厂商,给欣
25744,生产厂商,正清制药甲氨蝶呤片
25745,生产厂商,山西太原甲硝唑维B6片
25746,生产厂商,河南润弘本草三黄片
25747,生产厂商,云南植物药业注射用依托泊苷
25748,生产厂商,南通王氏保赤丸
25749,生产厂商,山西振东泰盛氟尿嘧啶氯化钠
25750,生产厂商,青山利康地塞米松磷酸钠滴眼
25751,生产厂商,深圳海王西洛他唑片
25752,生产厂商,晋新双鹤维生素B2注射液
25753,生产厂商,明瑞制药阿昔洛韦片
25754,生产厂商,泽众制药毛冬青片
25755,生产厂商,天峰制药硫酸镁注射液
25756,生产厂商,西安利君泼尼松龙片
25757,生产厂商,浙江国镜氨酪酸注射液
25758,生产厂商,云南白药宫血宁胶囊
25759,生产厂商,康缘桔都复方当归注射液
25760,生产厂商,永宁制药盐酸硫必利片
25761,生产厂商,奇林药业谷维素片
25762,生产厂商,山东华信制药葛根素注射液
25763,生产厂商,广东宏兴生化丸
25764,生产厂商,新霉素氟轻松乳膏
25765,生产厂商,亚宝药业马洛替酯缓释片
25766,生产厂商,世一堂五海瘿瘤丸
25767,生产厂商,北京京丰卡托普利片
25768,生产厂商,浙江仙琚醋酸甲羟孕酮片
25769,生产厂商,座康王克林霉素甲硝唑搽剂
25770,生产厂商,南宁维威制药陈香露白露片
25771,生产厂商,夏枯草胶囊
25772,生产厂商,利君现代冠脉宁片
25773,生产厂商,益赛普
25774,生产厂商,标智兰索拉唑肠溶胶囊
25775,生产厂商,利民制药吡拉西坦片
25776,生产厂商,方盛制药黄柏胶囊
25777,生产厂商,国森药业维生素AE胶丸
25778,生产厂商,健民叶开泰国药小儿麻甘颗粒
25779,生产厂商,宝宝一贴灵丁桂儿脐贴
25780,生产厂商,阿房宫药业维C银翘片
25781,生产厂商,河北医大制药强肝糖浆
25782,生产厂商,哈药三精制药诺捷一清颗粒
25783,生产厂商,几芙佳醋酸氯己定痔疮栓
25784,生产厂商,金象制药调经促孕丸
25785,生产厂商,江苏双鹤药业苦参碱氯化钠注
25786,生产厂商,双迪
25787,生产厂商,江苏晨牌乳核内消颗粒
25788,生产厂商,北京紫竹硫酸镁注射液
25789,生产厂商,龙泰滋补生发片
25790,生产厂商,正大丰海盐酸托莫西汀胶囊
25791,生产厂商,桑海制药排毒养颜片
25792,生产厂商,陕西康惠抗栓胶囊
25793,生产厂商,哈药二厂阑尾灵颗粒
25794,生产厂商,湖北潜江双氯芬酸钠滴眼液
25795,生产厂商,国瑞盐酸赖氨酸葡萄糖注射液
25796,生产厂商,同泰药业妇科止带片
25797,生产厂商,怡尔诺滑膜炎片
25798,生产厂商,健朗星
25799,生产厂商,万荣药业血塞通注射液
25800,生产厂商,武汉福星碳酸氢钠注射液
25801,生产厂商,参鸽药业清热醒脑灵丸
25802,生产厂商,辅仁药业盐酸多沙普仑注射液
25803,生产厂商,敖东延吉贞芪扶正颗粒
25804,生产厂商,容生硫酸庆大霉素注射液
25805,生产厂商,新和成金刚藤软胶囊
25806,生产厂商,民泰药业补金片
25807,生产厂商,深圳致君制药注射用头孢他啶
25808,生产厂商,三才石岐制药维生素B2片
25809,生产厂商,上海上药信谊药厂吡拉西坦片
25810,生产厂商,本草制药复方双金痔疮膏
25811,生产厂商,北京同仁堂羚羊感冒片
25812,生产厂商,华南药业卡托普利片
25813,生产厂商,江西铜鼓仁和对乙酰氨基酚颗
25814,生产厂商,河北武罗药业甲紫溶液
25815,生产厂商,四川国瑞莪术油注射液
25816,生产厂商,吉林华康药业胸腺肽注射液
25817,生产厂商,醋酸泼尼松片
25818,生产厂商,中方制药盐酸小檗胺片
25819,生产厂商,蓉生静丙
25820,生产厂商,武汉爱民注射用七叶皂苷钠
25821,生产厂商,江苏灵豹尿素维E乳膏
25822,生产厂商,逢春小儿止咳糖浆
25823,生产厂商,成都倍特甲磺酸帕珠沙星氯化
25824,生产厂商,康益药业复方双花口服液
25825,生产厂商,陕西科学院甘露聚糖肽口服溶
25826,生产厂商,湖北绿金子五维他口服溶液
25827,生产厂商,甘肃兰药盐酸可乐定片
25828,生产厂商,依利康
25829,生产厂商,北京同仁堂明目地黄丸
25830,生产厂商,鹏鹞药业盐酸普罗帕酮片
25831,生产厂商,长春万德根痛平胶囊
25832,生产厂商,浙江医药葡萄糖氯化钠注射液
25833,生产厂商,蒙药红花清肝十三味丸
25834,生产厂商,正瑞
25835,生产厂商,安徽仁和布洛芬片
25836,生产厂商,江苏神华宁心宝胶囊
25837,生产厂商,恒瑞制药拉坦前列素滴眼液
25838,生产厂商,美多丽
25839,生产厂商,山东端信堂心脑欣片
25840,生产厂商,盈康药业甲苯咪唑咀嚼片
25841,生产厂商,京西药业醋酸可的松片
25842,生产厂商,云中制药骨刺宁胶囊
25843,生产厂商,江西希尔康泰林旦乳膏
25844,生产厂商,宜昌人福盐酸金刚烷胺片
25845,生产厂商,太极集团耳聋左慈丸
25846,生产厂商,辽宁华瑞联合双氯芬酸钠肠溶
25847,生产厂商,陕西爱民和血胶囊
25848,生产厂商,盛翔制药金刚藤口服液
25849,生产厂商,开封康诺盐酸左旋咪唑片
25850,生产厂商,黑龙江济仁康媛颗粒
25851,生产厂商,国药集团武汉血液制品人血白
25852,生产厂商,天方药业肾上腺色腙片
25853,生产厂商,慈星
25854,生产厂商,君寿堂滋补生发片
25855,生产厂商,辽宁倍奇注射用硫酸链霉素
25856,生产厂商,奥星制药齐墩果酸胶囊
25857,生产厂商,天施康复方鱼腥草滴丸
25858,生产厂商,千金药业补血益母丸
25859,生产厂商,上海新亚注射用二巯丁二钠
25860,生产厂商,盖笛欣
25861,生产厂商,承德天原药业舒肝和胃丸
25862,生产厂商,长春长生基因注射用重组人干
25863,生产厂商,吉春制药肾石通颗粒
25864,生产厂商,郑州永和注射用复方甘草酸单
25865,生产厂商,安多明
25866,生产厂商,北京华神养阴生血合剂
25867,生产厂商,勃然制药调经养颜片
25868,生产厂商,cspc盐酸雷尼替丁胶囊
25869,生产厂商,西安利君醋酸可的松片
25870,生产厂商,正大丰海螺内酯片
25871,生产厂商,四川依科维生素B1片
25872,生产厂商,关爱制药阿娜尔妇洁液
25873,生产厂商,白云山医复方磺胺甲噁唑片
25874,生产厂商,DELPHARMLILLE
25875,生产厂商,禾丰盐酸洛贝林注射液
25876,生产厂商,山西华康补中益气丸
25877,生产厂商,陕中轻身消胖丸
25878,生产厂商,德众清咽片
25879,生产厂商,郑州卓峰盐酸洛美沙星滴耳液
25880,生产厂商,江苏天士力血尿胶囊
25881,生产厂商,长春银诺克清咽片
25882,生产厂商,重庆东方金钱草颗粒
25883,生产厂商,恩华药业五氟利多片
25884,生产厂商,达林克林霉素磷酸酯凝胶
25885,生产厂商,长江药业福多司坦片
25886,生产厂商,白敬宇制药维生素B2片
25887,生产厂商,同盟药业去氧氟尿苷胶囊
25888,生产厂商,汕头金石制药羧甲司坦片
25889,生产厂商,西安迪赛苯妥英钠片
25890,生产厂商,临汾健民盐酸苯海索片
25891,生产厂商,贵州圣都维B1乳酸钙片
25892,生产厂商,诚济制药羧甲司坦口服溶液
25893,生产厂商,东丰县吉鹿跳骨片
25894,生产厂商,贵阳济仁堂复方石韦胶囊
25895,生产厂商,五景药业盐酸羟苄唑滴眼液
25896,生产厂商,兴隆希力丹参酮胶囊
25897,生产厂商,全宇制药西咪替丁片
25898,生产厂商,海正盐酸多柔比星注射液
25899,生产厂商,遂成药业醋酸泼尼松片
25900,生产厂商,金诃藏药十一味金色丸
25901,生产厂商,海南林恒阿魏酸哌嗪片
25902,生产厂商,百利药业阿奇霉素颗粒
25903,生产厂商,西安康拜尔胆汁槟榔维B1胶
25904,生产厂商,重庆云海玄麦甘桔颗粒
25905,生产厂商,依伦定
25906,生产厂商,莱恩药业三磷酸腺苷二钠注射
25907,生产厂商,法国礼来注射用培美曲塞二钠
25908,生产厂商,吉林国药保胎灵
25909,生产厂商,鹏鹞药业肌醇烟酸酯片
25910,生产厂商,康诺药业注射用细胞色素C
25911,生产厂商,志远嘉宝血宝胶囊
25912,生产厂商,诺捷康前列舒乐胶囊
25913,生产厂商,海南全星注射用盐酸头孢替安
25914,生产厂商,宇斯药业碳酸氢钠注射液
25915,生产厂商,兴安药业菠萝蛋白酶肠溶片
25916,生产厂商,辰欣药业醋酸曲安奈德尿素乳
25917,生产厂商,迪沙盐酸安非他酮缓释片
25918,生产厂商,山西迈迪复方消痔栓
25919,生产厂商,福森药业盐酸雷尼替丁胶囊
25920,生产厂商,成都锦华肌苷片
25921,生产厂商,辽宁依生冻干人用狂犬病疫苗
25922,生产厂商,迪冉郸城依托红霉素颗粒
25923,生产厂商,上海雷允上药业羚羊角散
25924,生产厂商,方盛制药小儿四维葡钙颗粒
25925,生产厂商,河北国金依托红霉素颗粒
25926,生产厂商,陕西关爱甲硝唑氯己定洗剂
25927,生产厂商,上海新亚注射用盐酸头孢甲肟
25928,生产厂商,修正药业保胎无忧片
25929,生产厂商,天津君安藻酸双酯钠片
25930,生产厂商,鲁抗赛特诺氟沙星片
25931,生产厂商,唐林
25932,生产厂商,依科制药三七片
25933,生产厂商,陕西渭南华仁温胃舒胶囊
25934,生产厂商,汉草堂消瘿五海丸
25935,生产厂商,万全格列齐特缓释片
25936,生产厂商,石家庄四药盐酸吗啉胍片
25937,生产厂商,海特生物制药甲钴胺注射液
25938,生产厂商,无锡华澳十滴水
25939,生产厂商,北京中新制药甲巯咪唑片
25940,生产厂商,脐宝倍芪腹泻贴
25941,生产厂商,仁和堂药业葡醛内酯片
25942,生产厂商,爱普森药业叶酸片
25943,生产厂商,马应龙马应龙麝香痔疮膏
25944,生产厂商,麦普宁
25945,生产厂商,道君药业颠茄片
25946,生产厂商,石家庄华新药业独一味软胶囊
25947,生产厂商,赛而生物甲状腺片
25948,生产厂商,益佰制药板蓝根颗粒
25949,生产厂商,振东泰盛注射用头孢唑肟钠
25950,生产厂商,北京同仁堂小儿咽扁颗粒
25951,生产厂商,辰欣药业桂利嗪片
25952,生产厂商,湖南亚大盐酸乙哌立松片
25953,生产厂商,旭东海普氟尿嘧啶注射液
25954,生产厂商,华鑫药业丙硫氧嘧啶片
25955,生产厂商,安徽安科恒益阿莫西林颗粒
25956,生产厂商,柏赛罗达那唑胶囊
25957,生产厂商,重庆华邦注射用甲泼尼龙琥珀
25958,生产厂商,恒新药业眼氨肽注射液
25959,生产厂商,中联四药硬脂酸红霉素片
25960,生产厂商,德众川芎茶调颗粒
25961,生产厂商,河北山姆士盐酸二甲双胍缓释
25962,生产厂商,白云山消炎镇痛膏
25963,生产厂商,特素
25964,生产厂商,丹东医创溴丙胺太林片
25965,生产厂商,北京御本堂冠脉宁片
25966,生产厂商,松奇
25967,生产厂商,旺林堂对乙酰氨基酚片
25968,生产厂商,郑州韩都利肺胶囊
25969,生产厂商,贵州联盛血府逐瘀颗粒
25970,生产厂商,上海宝龙安庆十香丸
25971,生产厂商,显锋科技氯唑沙宗片
25972,生产厂商,湖北远大天天明妥布霉素滴眼
25973,生产厂商,太极集团通脉颗粒
25974,生产厂商,黑龙江天宏暖宫孕子丸
25975,生产厂商,正清制药红霉素肠溶胶囊
25976,生产厂商,斯利安
25977,生产厂商,海口奇力注射用磷霉素钠
25978,生产厂商,奥赛托星
25979,生产厂商,石药欧意注射用硫酸链霉素
25980,生产厂商,温馨消肿片
25981,生产厂商,四川百草堂朱砂莲胶囊
25982,生产厂商,江苏祥瑞氧氟沙星片
25983,生产厂商,醋酸氢化可的松滴眼液
25984,生产厂商,通化仁民消炎止痢灵片
25985,生产厂商,艾迪特
25986,生产厂商,润弘制药硫酸阿托品注射液
25987,生产厂商,金峰制药盐酸氨溴索葡萄糖注
25988,生产厂商,北京长城制药金刚藤软胶囊
25989,生产厂商,珠海同益橘红痰咳颗粒
25990,生产厂商,颐生堂维生素B1片
25991,生产厂商,广东九连山氯霉素片
25992,生产厂商,垂盆草颗粒
25993,生产厂商,遂成药业葡萄糖注射液
25994,生产厂商,吉林金复康益血生胶囊
25995,生产厂商,洮南药业注射用单磷酸阿糖腺
25996,生产厂商,捷凝
25997,生产厂商,常州康普盐酸苯海索片
25998,生产厂商,中杰药业双氯芬酸钠肠溶片
25999,生产厂商,哈尔滨力强小儿暖脐膏
26000,生产厂商,重庆华昶红草止鼾颗粒
26001,生产厂商,新亚注射用丝裂霉素
26002,生产厂商,利复星
26003,生产厂商,四川禾邦阳光元胡止痛片
26004,生产厂商,神威硬脂酸红霉素颗粒
26005,生产厂商,海南制药二厂酚磺乙胺注射液
26006,生产厂商,南京海鲸维生素E软胶囊
26007,生产厂商,山东健康盐酸美西律片
26008,生产厂商,药友制药三尖杉酯碱注射液
26009,生产厂商,一力制药风油精
26010,生产厂商,信谊醋酸可的松片
26011,生产厂商,辛伐他汀片
26012,生产厂商,白云山医药葡萄糖酸锌片
26013,生产厂商,天和麝香壮骨膏
26014,生产厂商,上海现代哈森地塞米松磷酸钠
26015,生产厂商,太平无极膏
26016,生产厂商,上海新亚丙硫氧嘧啶肠溶胶囊
26017,生产厂商,上海信谊乌苯美司片
26018,生产厂商,毛冬青胶囊
26019,生产厂商,三原妇炎舒片
26020,生产厂商,赛升药业眼氨肽注射液
26021,生产厂商,海陵药业乙酰谷酰胺注射液
26022,生产厂商,浙江东日吡拉西坦胶囊
26023,生产厂商,山西利丰华瑞氢氯噻嗪片
26024,生产厂商,康和盐酸普罗帕酮片
26025,生产厂商,依科制药维生素B1片
26026,生产厂商,海正注射用丝裂霉素
26027,生产厂商,迪冉郸城消癌平片
26028,生产厂商,阿茉立
26029,生产厂商,邦之匹伐他汀钙片
26030,生产厂商,国医堂制药藏青果颗粒
26031,生产厂商,宛西制药逍遥丸
26032,生产厂商,安徽双鹤乳酸左氧氟沙星氯化
26033,生产厂商,浙江迪耳林可霉素利多卡因凝
26034,生产厂商,广西源安堂肤阴洁液
26035,生产厂商,华佗华佗国药清咽片
26036,生产厂商,隆中药业复方石韦颗粒
26037,生产厂商,意速盐酸丁咯地尔片
26038,生产厂商,西南药业苯妥英钠片
26039,生产厂商,安徽济人复方蒲芩胶囊
26040,生产厂商,广东利泰曲克芦丁氯化钠注射
26041,生产厂商,江西汇仁利巴韦林片
26042,生产厂商,上海信谊氨苯蝶啶片
26043,生产厂商,新陇海药业复方倍氯米松樟脑
26044,生产厂商,法国赛诺菲-安万特盐酸胺碘
26045,生产厂商,天津力生制药枸橼酸喷托维林
26046,生产厂商,四川金药师盐酸异可利定片
26047,生产厂商,黑龙江鼎恒升北芪片
26048,生产厂商,天星制药注射用头孢唑肟钠
26049,生产厂商,吉林天光轻身消胖丸
26050,生产厂商,昆明南疆甘露醇注射液
26051,生产厂商,陕西白鹿参坤养血颗粒
26052,生产厂商,康乐果根痛平胶囊
26053,生产厂商,贵州天安盐酸二甲双胍肠溶片
26054,生产厂商,华润紫竹达那唑胶囊
26055,生产厂商,友邦制药强肝糖浆
26056,生产厂商,川抗吗替麦考酚酯分散片
26057,生产厂商,南京瑞尔阿昔洛韦片
26058,生产厂商,兴邦宫颈癌片
26059,生产厂商,山西华元接骨续筋片
26060,生产厂商,威海华新氧氟沙星滴耳液
26061,生产厂商,恩华药业利鲁唑片
26062,生产厂商,三金药业三金片
26063,生产厂商,四川制药制剂注射用头孢噻肟
26064,生产厂商,步长宫瘤消胶囊
26065,生产厂商,碑林药业和血明目片
26066,生产厂商,嘉林盐酸胺碘酮片
26067,生产厂商,浙江康莱特康莱特注射液
26068,生产厂商,天康药业化瘀祛斑胶囊
26069,生产厂商,尖峰注射用头孢哌酮钠舒巴坦
26070,生产厂商,湖南亚大硫酸锌片
26071,生产厂商,杭州华威三七片
26072,生产厂商,金诃藏药仁青芒觉
26073,生产厂商,东陵药业鬼臼毒素酊
26074,生产厂商,石药集团甘草流浸膏
26075,生产厂商,贵阳德昌祥防风通圣丸
26076,生产厂商,圣特记清火栀麦片
26077,生产厂商,百裕盐酸氨溴索注射液
26078,生产厂商,远程制药抗妇炎胶囊
26079,生产厂商,达芙文
26080,生产厂商,陕西东泰制药活力源片
26081,生产厂商,银涛药业过氧化氢溶液
26082,生产厂商,湖北美宝药业阿苯达唑片
26083,生产厂商,震达
26084,生产厂商,悦康力欣注射用头孢哌酮钠舒
26085,生产厂商,泰邦生物人血白蛋白
26086,生产厂商,陕西利君补中益气片
26087,生产厂商,胡庆余堂五子衍宗丸
26088,生产厂商,广东环球制药复方甲苯咪唑片
26089,生产厂商,索坦
26090,生产厂商,武汉大安聚明胶肽注射液
26091,生产厂商,泰恩康制药维A酸乳膏
26092,生产厂商,吉林敖东力源肾复康片
26093,生产厂商,重庆科瑞醋酸泼尼松龙片
26094,生产厂商,国瑞药业注射用硫酸链霉素
26095,生产厂商,石药唐威补肾强身片
26096,生产厂商,本草纲目夏枯草膏
26097,生产厂商,泰康丁细牙痛胶囊
26098,生产厂商,四川科伦普卢利沙星片
26099,生产厂商,寿如松氢化可的松片
26100,生产厂商,德联制药复方黄藤洗液
26101,生产厂商,易喷爽复方醋酸氯己定喷剂
26102,生产厂商,莱恩药业葡醛酸钠注射液
26103,生产厂商,新先锋注射用两性霉素B
26104,生产厂商,先强药业盐酸利托君注射液
26105,生产厂商,华润紫竹盐酸普罗帕酮注射液
26106,生产厂商,大冢制药盐酸利多卡因注射液
26107,生产厂商,辰欣药业依托泊苷注射液
26108,生产厂商,陕西兴邦丙戊酸钠片
26109,生产厂商,鲁抗赛特阿奇霉素片
26110,生产厂商,万胜药业生精片
26111,生产厂商,天宇奥森维生素E软胶囊
26112,生产厂商,杭州民生盐酸消旋山莨菪碱注
26113,生产厂商,羚锐卫生麝香壮骨膏
26114,生产厂商,河南信心药业小儿麻甘颗粒
26115,生产厂商,江苏黄河药业卡托普利片
26116,生产厂商,北海阳光左旋多巴片
26117,生产厂商,春哥益肾灵颗粒
26118,生产厂商,宛东药业益肾生发丸
26119,生产厂商,四川广元蓉成小儿解表止咳口
26120,生产厂商,新高制药氟尿嘧啶注射液
26121,生产厂商,誉隆亚东药业保胎灵
26122,生产厂商,大连水产药业维生素E软胶囊
26123,生产厂商,百视明增光胶囊
26124,生产厂商,欣欣止痒消炎水
26125,生产厂商,北京万辉双鹤盐酸黄酮哌酯片
26126,生产厂商,苏州中化聚卡波非钙片
26127,生产厂商,汉森甲硝唑片
26128,生产厂商,长春长庆复方甘草酸单铵注射
26129,生产厂商,北京同仁堂金黄抱龙丸
26130,生产厂商,广西南宁百会千金藤啶碱片
26131,生产厂商,第一生物复方牛胎肝提取物片
26132,生产厂商,贵州良济宁心宝胶囊
26133,生产厂商,石药欧意阿昔洛韦片
26134,生产厂商,山东博山硝酸异山梨酯片
26135,生产厂商,北京富国堂医药科技新生化颗
26136,生产厂商,九芝堂补中益气丸
26137,生产厂商,天瑞药业三维钙片
26138,生产厂商,太极集团小儿止咳糖浆
26139,生产厂商,山西仟源白消安片
26140,生产厂商,联环药业叶酸片
26141,生产厂商,北京双鹭醋酸奥曲肽注射液
26142,生产厂商,金陵南京金陵脉络宁口服液
26143,生产厂商,石家康力药业桂利嗪片
26144,生产厂商,玉安药业维生素C片
26145,生产厂商,铜鼓仁和强肝糖浆
26146,生产厂商,冠峰制药陈香露白露片
26147,生产厂商,圣宝甲硝唑氯己定洗剂
26148,生产厂商,重庆国泰康宁眼氨肽注射液
26149,生产厂商,河北康泰小儿复方磺胺甲噁唑
26150,生产厂商,东信药业玉屏风口服液
26151,生产厂商,补达秀
26152,生产厂商,陕西开元莱葛颗粒
26153,生产厂商,叶开泰精制狗皮膏
26154,生产厂商,湖北美宝三七片
26155,生产厂商,三明天泰复方倍氯米松樟脑乳
26156,生产厂商,天宇奥森阿法骨化醇软胶囊
26157,生产厂商,星斗药业苯妥英钠片
26158,生产厂商,北京御本堂养荣祛斑膏
26159,生产厂商,希爱力
26160,生产厂商,汉堂生物制药利巴韦林含片
26161,生产厂商,茂祥制药复方环磷酰胺片
26162,生产厂商,维康达
26163,生产厂商,羚锐卫生关节止痛膏
26164,生产厂商,赤峰蒙欣盐酸小檗碱片
26165,生产厂商,平洁甲硝唑乳膏
26166,生产厂商,老拨云堂宁心宝胶囊
26167,生产厂商,力生泛酸钙片
26168,生产厂商,丽珠制药注射用普罗瑞林
26169,生产厂商,格林生物醋酸地塞米松片
26170,生产厂商,四川九龙青春轻身消胖丸
26171,生产厂商,雅皓
26172,生产厂商,宝丽婷克霉唑阴道片
26173,生产厂商,太福鼻渊丸
26174,生产厂商,新和成药业无极膏
26175,生产厂商,天峰制药丝白祛斑软膏
26176,生产厂商,惠诺药业肝素钠注射液
26177,生产厂商,联盛药业调经养颜片
26178,生产厂商,力生制药碳酸氢钠片
26179,生产厂商,上海朝晖奋乃静片
26180,生产厂商,海燕药业苏黄止咳胶囊
26181,生产厂商,赛克同
26182,生产厂商,太福制药槐角丸
26183,生产厂商,必康转化糖注射液
26184,生产厂商,四川升和紫杉醇注射液
26185,生产厂商,嘉林硫唑嘌呤片
26186,生产厂商,津诺
26187,生产厂商,成都森科肾石通颗粒
26188,生产厂商,江西青峰复方鱼腥草片
26189,生产厂商,辽宁天医生物胰岛素注射液
26190,生产厂商,贵州益佰艾迪注射液
26191,生产厂商,白云山中一乌蛇止痒丸
26192,生产厂商,北京中新维生素B2片
26193,生产厂商,鲁南拉坦前列素滴眼液
26194,生产厂商,广州巨虹复方鱼腥草片
26195,生产厂商,恒泽
26196,生产厂商,莎普爱思强身跳骨片
26197,生产厂商,信谊天平己烯雌酚片
26198,生产厂商,中杰药业齿痛消炎灵颗粒
26199,生产厂商,金海发药业抑亢丸
26200,生产厂商,泉州中侨安胎丸
26201,生产厂商,克赛
26202,生产厂商,华南药业盐酸维拉帕米片
26203,生产厂商,成纪生物甘露醇注射液
26204,生产厂商,择泰
26205,生产厂商,广东隆赋药业注射用单磷酸阿
26206,生产厂商,吉林华港制药头孢羟氨苄甲氧
26207,生产厂商,上海新亚注射用头孢噻肟钠
26208,生产厂商,蒲地蓝消炎口服液
26209,生产厂商,白云山光华乙胺嘧啶片
26210,生产厂商,云南通大保胎无忧片
26211,生产厂商,易善复
26212,生产厂商,上海上药乙酰谷酰胺注射液
26213,生产厂商,贵州飞云岭甲硝唑片
26214,生产厂商,双鹭药业注射用生长抑素
26215,生产厂商,辰欣药业维生素K1注射液
26216,生产厂商,天眩清天麻素胶囊
26217,生产厂商,白云山中一鼻咽灵片
26218,生产厂商,华北制药盐酸胺碘酮胶囊
26219,生产厂商,广药集团癣宁搽剂
26220,生产厂商,联邦左福康盐酸左氧氟沙星胶
26221,生产厂商,威地美
26222,生产厂商,新疆华世丹甘露醇注射液
26223,生产厂商,络泰血塞通软胶囊
26224,生产厂商,瑞新药业维生素B6片
26225,生产厂商,益馨康麝香抗栓胶囊
26226,生产厂商,英雄龙胆泻肝丸
26227,生产厂商,重庆和平金钱草颗粒
26228,生产厂商,捷众制药复方水杨酸樟碘溶液
26229,生产厂商,华润双鹤药业注射用硝普钠
26230,生产厂商,星斗药业呋塞米片
26231,生产厂商,盘龙克比热提片
26232,生产厂商,洮南药业环磷腺苷葡胺注射液
26233,生产厂商,海南海神同洲氧氟沙星片
26234,生产厂商,山东鲁抗葡萄糖酸钙片
26235,生产厂商,康力星
26236,生产厂商,巨康脂脉康胶囊
26237,生产厂商,必康尼可刹米注射液
26238,生产厂商,成都天台山注射用盐酸罗哌卡
26239,生产厂商,禾润板蓝根颗粒
26240,生产厂商,吉林康乃尔氯化钠注射液
