生产厂商:ID,:LABEL,name
29911,生产厂商,海南利能康泰注射用盐酸克林
29912,生产厂商,宏奇药业复方吲哚美辛酊
29913,生产厂商,长春普华熊胆丸
29914,生产厂商,真昔
29915,生产厂商,槐花氟轻松维B6乳膏
29916,生产厂商,天津天药醋酸泼尼松片
29917,生产厂商,普德药业注射用异环磷酰胺
29918,生产厂商,山西邦仕得药业西洛他唑片
29919,生产厂商,陕西天洋归脾丸
29920,生产厂商,一正药业消炎镇痛膏
29921,生产厂商,苏州俞氏酒石酸美托洛尔缓释
29922,生产厂商,敖东延吉乙酰谷酰胺注射液
29923,生产厂商,四川大千利胆片
29924,生产厂商,中联四药螺内酯片
29925,生产厂商,重庆科瑞醋酸地塞米松片
29926,生产厂商,海大科技制药环磷腺苷葡胺注
29927,生产厂商,蒙药玉簪清咽十五味散
29928,生产厂商,天源制药小儿复方磺胺甲噁唑
29929,生产厂商,亨达盛康阿魏酸钠片
29930,生产厂商,信谊百路达酒石酸美托洛尔片
29931,生产厂商,齐都药业尼麦角林片
29932,生产厂商,金水宝制药金水宝胶囊
29933,生产厂商,同仁堂阑尾消炎丸
29934,生产厂商,南少林药业甲硫氨酸维B1注
29935,生产厂商,珠江制药维生素A软胶囊
29936,生产厂商,湖南汉森丙硫氧嘧啶片
29937,生产厂商,东康药业氯霉素胶囊
29938,生产厂商,重庆东方陈香露白露片
29939,生产厂商,康臣药业果糖二磷酸钠注射液
29940,生产厂商,盐酸特比萘芬乳膏
29941,生产厂商,江苏黄河药业硬脂酸红霉素片
29942,生产厂商,健坤制药氧氟沙星片
29943,生产厂商,扬州艾迪制药盐酸吗啉胍片
29944,生产厂商,吉林吉春人工牛黄甲硝唑胶囊
29945,生产厂商,润阳药业盐酸氨溴索葡萄糖注
29946,生产厂商,双益雷公藤多苷片
29947,生产厂商,皇象铁力蓝天硫酸锌片
29948,生产厂商,扬子江药业紫杉醇注射液
29949,生产厂商,扬子江药业注射用胸腺五肽
29950,生产厂商,广东彼迪托西酸舒他西林胶囊
29951,生产厂商,华北制药氟尿嘧啶口服乳
29952,生产厂商,沈阳红旗口腔炎喷雾剂
29953,生产厂商,四川川大华西胰岛素注射液
29954,生产厂商,圣鲁制药盐酸消旋山莨菪碱注
29955,生产厂商,山东明人福瑞达消炎镇痛膏
29956,生产厂商,上海现代哈森亚硫酸氢钠甲萘
29957,生产厂商,五洲通药业乙酰谷酰胺注射液
29958,生产厂商,四川锡成氨茶碱片
29959,生产厂商,南通中华药业硝酸咪康唑乳膏
29960,生产厂商,达克宁
29961,生产厂商,白云山医三磷酸腺苷二钠片
29962,生产厂商,太原药业盐酸苯海拉明片
29963,生产厂商,力生制药马来酸氯苯那敏片
29964,生产厂商,大峻镇痫片
29965,生产厂商,川抗甘露聚糖肽口服溶液
29966,生产厂商,吉林敖东洮南小牛脾提取物注
29967,生产厂商,信谊金朱甲硫酸新斯的明注射
29968,生产厂商,三明天泰天麻蜜环菌片
29969,生产厂商,植恩萘普生栓
29970,生产厂商,通化百信补金片
29971,生产厂商,罗浮柴胡注射液
29972,生产厂商,坦亮
29973,生产厂商,紫竹爱维
29974,生产厂商,南京恒生制药聚甲酚磺醛溶液
29975,生产厂商,上海禾丰乙酰谷酰胺注射液
29976,生产厂商,力唐宁盐酸二甲双胍缓释片
29977,生产厂商,南京小营甘露醇注射液
29978,生产厂商,滇虹骨痛灵酊
29979,生产厂商,京卫制药米诺地尔喷雾剂
29980,生产厂商,广东奇灵调经祛斑片
29981,生产厂商,潜江制药注射用头孢呋辛钠
29982,生产厂商,太极集团利胆排石片
29983,生产厂商,九华华源百蕊片
29984,生产厂商,杭州胡庆余堂小儿泄泻停颗粒
29985,生产厂商,上海雷允上药业柘木糖浆
29986,生产厂商,神威参麦注射液
29987,生产厂商,华南药业盐酸普罗帕酮片
29988,生产厂商,诺欣生
29989,生产厂商,华侨药业补金片
29990,生产厂商,北海阳光药业左旋多巴片
29991,生产厂商,晨骨刺宁片
29992,生产厂商,华仁制药盐酸妥洛特罗片
29993,生产厂商,普元除湿止痒洗液
29994,生产厂商,吉林银河双氯芬酸钠肠溶片
29995,生产厂商,新天药业坤泰胶囊
29996,生产厂商,山西仟源盐酸氟西汀胶囊
29997,生产厂商,重庆迪康长江聚明胶肽注射液
29998,生产厂商,沈阳志鹰氯化钠注射液
29999,生产厂商,同仁堂荷叶丸
30000,生产厂商,金石滩制药硬脂酸红霉素片
30001,生产厂商,威高药业二乙酰氨乙酸乙二胺
30002,生产厂商,锦州九泰磷酸川芎嗪氯化钠注
30003,生产厂商,湖北明和红霉素肠溶微丸胶囊
30004,生产厂商,澳迩药业喘嗽宁片
30005,生产厂商,广州白云山明兴注射用门冬酰
30006,生产厂商,长春迪瑞维生素C咀嚼片
30007,生产厂商,云阳盐酸普罗帕酮片
30008,生产厂商,东宝五药枣参安神胶囊
30009,生产厂商,纽兰药业葡萄糖酸钙口服溶液
30010,生产厂商,白敬宇制药盐酸普罗帕酮片
30011,生产厂商,西南药业地塞米松磷酸钠注射
30012,生产厂商,海南天煌注射用头孢美唑钠
30013,生产厂商,神苗葡萄糖酸锌颗粒
30014,生产厂商,国帝药业大活络丸
30015,生产厂商,北京万辉双鹤四维他胶囊
30016,生产厂商,御宁复方胚肝铁铵片
30017,生产厂商,海鹤板蓝根颗粒
30018,生产厂商,江西天施康中药抗宫炎片
30019,生产厂商,信谊硫唑嘌呤片
30020,生产厂商,西安远大德天药业接骨续筋片
30021,生产厂商,康博士制药一清片
30022,生产厂商,贵州浩诚柏栀祛湿喷雾剂
30023,生产厂商,江苏海昇五妙水仙膏
30024,生产厂商,佳苏仑
30025,生产厂商,冠峰制药产妇康洗液
30026,生产厂商,牡丹江灵泰鸦胆子油口服乳液
30027,生产厂商,杭州爱大林旦乳膏
30028,生产厂商,世扶尼
30029,生产厂商,吉林利华制药头孢氨苄甲氧苄
30030,生产厂商,圣济堂重楼解毒酊
30031,生产厂商,吉林吉春参皇软膏
30032,生产厂商,江苏天士力富马酸酮替芬片
30033,生产厂商,云南楚雄云中小儿麻甘颗粒
30034,生产厂商,尚岩
30035,生产厂商,甘肃大得利注射用腺苷钴胺
30036,生产厂商,注射用尿促卵泡激素
30037,生产厂商,武生旺宁
30038,生产厂商,黑龙江天龙维胺酯维E乳膏
30039,生产厂商,国药奥美拉唑肠溶片
30040,生产厂商,丹东宏业氨肽素片
30041,生产厂商,山西国润高三尖杉酯碱注射液
30042,生产厂商,华北制药阿莫西林舒巴坦匹酯
30043,生产厂商,达仁堂化毒丹
30044,生产厂商,广东华南羧甲司坦片
30045,生产厂商,信谊马来酸氯苯那敏片
30046,生产厂商,中和制药阿莫西林胶囊
30047,生产厂商,江苏康缘阿仑膦酸钠片
30048,生产厂商,安仑阿仑膦酸钠片
30049,生产厂商,方兴制药骨刺平片
30050,生产厂商,海神同洲克拉霉素胶囊
30051,生产厂商,星昊医药甲钴胺胶囊
30052,生产厂商,博山制药奋乃静片
30053,生产厂商,九芝堂小儿生血糖浆
30054,生产厂商,珠海生化地喹氯铵含片
30055,生产厂商,安徽仁和氟康唑片
30056,生产厂商,新陇海药业尿素维E乳膏
30057,生产厂商,亚硫酸氢钠甲萘醌注射液
30058,生产厂商,山西康意盐酸吗啉胍片
30059,生产厂商,江苏天禾迪赛诺苦参碱氯化钠
30060,生产厂商,拜新同
30061,生产厂商,利群药业扑米酮片
30062,生产厂商,贵州信邦制药扶正康颗粒
30063,生产厂商,黑龙江济仁喘嗽宁片
30064,生产厂商,南京圣和消癌平片
30065,生产厂商,广东星昊注射用胸腺肽
30066,生产厂商,天朗制药消旋山莨菪碱滴眼液
30067,生产厂商,铍宝克痒敏醑
30068,生产厂商,江西红星琥乙红霉素片
30069,生产厂商,希望制药维A酸乳膏
30070,生产厂商,绿十字静注人免疫球蛋白
30071,生产厂商,格林生物硬脂酸红霉素片
30072,生产厂商,爱普森药业盐酸可乐定片
30073,生产厂商,华世大蒜素软胶囊
30074,生产厂商,珠海联邦注射用哌拉西林钠他
30075,生产厂商,双鹭药业替莫唑胺胶囊
30076,生产厂商,恒健制药头孢氨苄胶囊
30077,生产厂商,贵州关德兴宝芝林前列舒乐颗
30078,生产厂商,搏拿
30079,生产厂商,亚征利
30080,生产厂商,江西佑美肾石通颗粒
30081,生产厂商,辽宁格林地巴唑片
30082,生产厂商,辅仁药业托西酸舒他西林胶囊
30083,生产厂商,国药集团广东环球制药依托红
30084,生产厂商,宛西制药妇科养荣丸
30085,生产厂商,中鑫
30086,生产厂商,山东仁和堂羧甲司坦片
30087,生产厂商,广州粤华芦笋菠萝蛋白酶胶囊
30088,生产厂商,三益红霉素软膏
30089,生产厂商,鹿王制药颠茄片
30090,生产厂商,宏兴制药生化丸
30091,生产厂商,吉祥春清脑降压片
30092,生产厂商,江苏亚邦爱普森叶酸片
30093,生产厂商,华山制药碳酸氢钠注射液
30094,生产厂商,诺福丁
30095,生产厂商,山西黄河增光胶囊
30096,生产厂商,炎黄本草药业板蓝根颗粒
30097,生产厂商,华南药业复方血栓通软胶囊
30098,生产厂商,修正荡石片
30099,生产厂商,新百药业胰岛素注射液
30100,生产厂商,海王福药尼可刹米注射液
30101,生产厂商,黑龙江鼎恒升硫酸锌片
30102,生产厂商,邯郸制药丹杞颗粒
30103,生产厂商,博士伦福瑞达硫酸软骨素滴眼
30104,生产厂商,上海衡山熊去氧胆酸片
30105,生产厂商,神威药业葡萄糖酸锌颗粒
30106,生产厂商,乐家老铺明目地黄丸
30107,生产厂商,山东新华氨茶碱片
30108,生产厂商,舒贝灵妇炎康分散片
30109,生产厂商,广东环球依托红霉素片
30110,生产厂商,茂祥制药甲氨蝶呤片
30111,生产厂商,中大双氯芬酸钠缓释片
30112,生产厂商,辽宁华瑞联合维A酸乳膏
30113,生产厂商,森科制药妇宁康胶囊
30114,生产厂商,北京曙光阿咖酚散
30115,生产厂商,无锡凯夫注射用胸腺肽
30116,生产厂商,润泽制药注射用头孢曲松钠
30117,生产厂商,永孜堂降脂减肥片
30118,生产厂商,三宝生化复方肝浸膏片
30119,生产厂商,中华安胎丸
30120,生产厂商,太原药业维生素B6片
30121,生产厂商,烟台中洲叶酸片
30122,生产厂商,海南葫芦娃注射用盐酸甲氯芬
30123,生产厂商,龙泰化痰平喘片
30124,生产厂商,仁和堂氢氯噻嗪片
30125,生产厂商,大深林盐酸雷尼替丁胶囊
30126,生产厂商,御本堂药业冠脉宁片
30127,生产厂商,辅仁药业酒石酸美托洛尔注射
30128,生产厂商,东药吡罗昔康片
30129,生产厂商,贵州同济堂盐酸左旋咪唑宝塔
30130,生产厂商,南京恒生聚甲酚磺醛溶液
30131,生产厂商,江西山香肾石通颗粒
30132,生产厂商,上海皇象铁力蓝天盐酸环丙沙
30133,生产厂商,四川美大康琥乙红霉素片
30134,生产厂商,通和制药阿昔洛韦分散片
30135,生产厂商,齐源堂红草止鼾胶囊
30136,生产厂商,俊宏药业肿节风胶囊
30137,生产厂商,永生堂辛伐他汀片
30138,生产厂商,江苏晨牌苦参碱氯化钠注射液
30139,生产厂商,北京同仁堂如意金黄散
30140,生产厂商,江西泽众睾丸片
30141,生产厂商,隆化诺
30142,生产厂商,四川明欣维A酸乳膏
30143,生产厂商,河北百善药业降脂减肥片
30144,生产厂商,三精葡萄糖酸钙口服溶液
30145,生产厂商,震元制药克拉霉素片
30146,生产厂商,同济堂去痛片
30147,生产厂商,黑龙江乌苏里江哈尔滨氯诺昔
30148,生产厂商,天津同仁堂清咽片
30149,生产厂商,时代阳光药业灵仙跌打片
30150,生产厂商,徐州莱恩甘露聚糖肽注射液
30151,生产厂商,科苑维生素E软胶囊
30152,生产厂商,禾丰氢溴酸东莨菪碱注射液
30153,生产厂商,内蒙京新药业康复新液
30154,生产厂商,替他宁
30155,生产厂商,华北制药注射用青霉素钠
30156,生产厂商,辽宁奥达豆腐果苷片
30157,生产厂商,亚太药业乙酰唑胺片
30158,生产厂商,北京同仁堂轻身消胖丸
30159,生产厂商,科赛斯
30160,生产厂商,江苏大洋甲硝唑维B6片
30161,生产厂商,长春海外制药肾炎四味胶囊
30162,生产厂商,海斯制药盐酸利多卡因注射液
30163,生产厂商,江西京通美联消疲灵颗粒
30164,生产厂商,优甲乐
30165,生产厂商,山西同达乙酰螺旋霉素片
30166,生产厂商,湘雅制药益脉康片
30167,生产厂商,颈复康药业大山楂丸
30168,生产厂商,四川制药制剂阿莫西林胶囊
30169,生产厂商,浙江维康固元胶囊
30170,生产厂商,湖南中和阿莫西林颗粒
30171,生产厂商,康福来夏桑菊颗粒
30172,生产厂商,广仁药业肝复康丸
30173,生产厂商,锦华药业盐酸左氧氟沙星片
30174,生产厂商,晨牌药业产妇安颗粒
30175,生产厂商,迪康长江制药苦参碱氯化钠注
30176,生产厂商,哈药总厂硼酸软膏
30177,生产厂商,同仁堂大黄
30178,生产厂商,广东恒诚小儿七星茶颗粒
30179,生产厂商,双鼎制药抑眩宁胶囊
30180,生产厂商,泰恩康制药消炎镇痛膏
30181,生产厂商,上海长征富民甘油氯化钠注射
30182,生产厂商,新达苏
30183,生产厂商,北京中新维生素C片
30184,生产厂商,山西立业制药维生素E软胶囊
30185,生产厂商,丽珠利民血栓通注射液
30186,生产厂商,远程健脑胶囊
30187,生产厂商,广东三蓝安胎丸
30188,生产厂商,天龙制药氟轻松维B6乳膏
30189,生产厂商,药都制药五子衍宗丸
30190,生产厂商,奥司惠
30191,生产厂商,浙江爱生药业金刚藤软胶囊
30192,生产厂商,哈药诺捷一清颗粒
30193,生产厂商,江西赣南喷托维林氯化铵糖浆
30194,生产厂商,四川通园通脉片
30195,生产厂商,皇隆制药注射用呋塞米
30196,生产厂商,中杰药业西咪替丁片
30197,生产厂商,吉林福康药业蒲地蓝消炎片
30198,生产厂商,百岁行唐草片
30199,生产厂商,哈药六乳酸菌素片
30200,生产厂商,左克
30201,生产厂商,瑞阳制药环磷腺苷葡胺注射液
30202,生产厂商,北京华润高科复方苁蓉补肾合
30203,生产厂商,方略药业黄藤素片
30204,生产厂商,卫生材料药业消炎镇痛膏
30205,生产厂商,盛翔制药小儿感冒宁合剂
30206,生产厂商,君碧莎消癌平片
30207,生产厂商,大冢制药孟鲁司特钠咀嚼片
30208,生产厂商,辅仁药业阿奇霉素片
30209,生产厂商,卫晶普拉洛芬滴眼液
30210,生产厂商,浙江海力生辅酶Q10软胶囊
30211,生产厂商,东维力
30212,生产厂商,盐酸伊曲康唑胶囊
30213,生产厂商,瑞眸舒氯霉素滴眼液
30214,生产厂商,德致苍夷滴鼻剂
30215,生产厂商,福建中合医药羧甲司坦片
30216,生产厂商,远洋生物滑膜炎片
30217,生产厂商,康德乐注射用醋酸卡泊芬净
30218,生产厂商,四川制药制剂注射用阿洛西林
30219,生产厂商,衡山药业青霉素V钾胶囊
30220,生产厂商,河南同源地塞米松磷酸钠注射
30221,生产厂商,昆明中药宁神丸
30222,生产厂商,南阳普康药业醋酸地塞米松片
30223,生产厂商,柏赛罗布洛芬缓释胶囊
30224,生产厂商,利群药业盐酸普罗帕酮片
30225,生产厂商,长春海外狼疮丸
30226,生产厂商,山西天源硫酸庆大霉素注射液
30227,生产厂商,海南制药厂西咪替丁片
30228,生产厂商,乐仁堂香砂养胃丸
30229,生产厂商,潜江制药托吡卡胺滴眼液
30230,生产厂商,江西九连山复方鱼腥草片
30231,生产厂商,陕西东泰制药尿塞通片
30232,生产厂商,广州珠江制药六合维生素丸
30233,生产厂商,常泰药业鸦胆子油口服乳液
30234,生产厂商,山西天源小儿复方磺胺甲噁唑
30235,生产厂商,悦康药业银杏叶提取物注射液
30236,生产厂商,福善美
30237,生产厂商,江苏美通雷公藤多苷片
30238,生产厂商,贵州科顿小儿复方磺胺甲噁唑
30239,生产厂商,英平药业降脂减肥片
30240,生产厂商,仙琚醋酸甲羟孕酮片
30241,生产厂商,阿赛松
30242,生产厂商,海南制药二厂肝素钠注射液
30243,生产厂商,白天鹅药业乳酸菌素片
30244,生产厂商,广东三才石岐复合维生素B片
30245,生产厂商,石家康力药业谷维素片
30246,生产厂商,英联生物消癌平片
30247,生产厂商,东康药业醋酸可的松滴眼液
30248,生产厂商,安徽金太阳眼氨肽注射液
30249,生产厂商,海口制药阿莫西林分散片
30250,生产厂商,安阳路德小儿敷脐止泻散
30251,生产厂商,辰欣红霉素软膏
30252,生产厂商,一品红注射用盐酸甲氯芬酯
30253,生产厂商,广东宏兴利胆片
30254,生产厂商,郑州致和小儿复方磺胺甲噁唑
30255,生产厂商,华鲁吗替麦考酚酯胶囊
30256,生产厂商,五景药业复方氯化钠滴眼液
30257,生产厂商,弘美制药复方吡拉西坦脑蛋白
30258,生产厂商,浙北药业曲克芦丁口服溶液
30259,生产厂商,四川远大蜀阳骨苓通痹丸
30260,生产厂商,豪降之厄贝沙坦分散片
30261,生产厂商,上海信谊卡托普利片
30262,生产厂商,鲁南厚普制药小儿消积止咳口
30263,生产厂商,远大医药甲硝唑维B6片
30264,生产厂商,君士达新
30265,生产厂商,禾邦阳光八珍颗粒
30266,生产厂商,郑州泰丰硫酸锌片
30267,生产厂商,金太阳生化乙酰谷酰胺注射液
30268,生产厂商,格拉丹东药业消肿片
30269,生产厂商,吉林吉春小儿解感片
30270,生产厂商,红石药业阿昔洛韦胶囊
30271,生产厂商,惠美健曲咪新乳膏
30272,生产厂商,广州万正胸腺肽注射液
30273,生产厂商,江西省芙蓉堂药业补中益气合
30274,生产厂商,河南蓝图制药马洛替酯片
30275,生产厂商,青岛黄海制药硫酸锌片
30276,生产厂商,山东康宁右旋糖酐20葡萄糖
30277,生产厂商,罗浮山国药盐酸左氧氟沙星片
30278,生产厂商,天大益安回生口服液
30279,生产厂商,威利宁
30280,生产厂商,金恒制药阿苯达唑片
30281,生产厂商,五洲通药业注射用盐酸丁卡因
30282,生产厂商,瑞科沙
30283,生产厂商,倍特药业维生素K1注射液
30284,生产厂商,消石利胆胶囊
30285,生产厂商,内蒙古库伦乌兰三味汤散
30286,生产厂商,西安澜泰小儿生血糖浆
30287,生产厂商,萌尔夫
30288,生产厂商,辽源誉隆亚东盐酸金刚烷胺糖
30289,生产厂商,富露施
30290,生产厂商,湘江曲匹布通片
30291,生产厂商,贵州金桥痔疮外洗药
30292,生产厂商,管城制药注射用头孢唑肟钠
30293,生产厂商,中杰药业华法林钠片
30294,生产厂商,神通消炎退热颗粒
30295,生产厂商,辽宁绿丹红霉素肠溶胶囊
30296,生产厂商,华润神鹿儿泻停颗粒
30297,生产厂商,江西南昌鼻炎灵片
30298,生产厂商,包林
30299,生产厂商,武汉太福夏枯草膏
30300,生产厂商,西岳制药托西酸舒他西林胶囊
30301,生产厂商,聚荣制药氯霉素片
30302,生产厂商,广东泰恩康复方醋酸地塞米松
30303,生产厂商,湖南恒生制药注射用泮托拉唑
30304,生产厂商,吉林康乃尔吡拉西坦葡萄糖注
30305,生产厂商,同济堂氨甲环酸片
30306,生产厂商,上海延安药业诺氟沙星胶囊
30307,生产厂商,丽珠制药替硝唑片
30308,生产厂商,珠海生化碳酸钙片
30309,生产厂商,江西东风注射用头孢噻肟钠
30310,生产厂商,南京中山活血止痛胶囊
30311,生产厂商,北京同仁堂三七片
30312,生产厂商,太极集团小儿智力糖浆
30313,生产厂商,甲保可甲钴胺胶囊
30314,生产厂商,江苏浦金药业甲硫酸新斯的明
30315,生产厂商,湖南明瑞阿昔洛韦片
30316,生产厂商,开封康诺维D2磷酸氢钙片
30317,生产厂商,利君琥乙红霉素片
30318,生产厂商,欧来宁
30319,生产厂商,华润双鹤药业注射用硫普罗宁
30320,生产厂商,鲁抗大地药业排毒清脂胶囊
30321,生产厂商,郑州莱士人血白蛋白
30322,生产厂商,南珠制药小儿化毒散
30323,生产厂商,瑞易宁
30324,生产厂商,南京海辰注射用单磷酸阿糖腺
30325,生产厂商,山东仁和堂肌苷片
30326,生产厂商,安生新霉素氟轻松乳膏
30327,生产厂商,中科院医学研究所胸腺肽注射
30328,生产厂商,海悦药业胸腺肽注射液
30329,生产厂商,谷悦骨肽片
30330,生产厂商,上海雷允上药业复方丹参片
30331,生产厂商,太极集团杞菊地黄丸
30332,生产厂商,世贸天阶氢氯噻嗪片
30333,生产厂商,九天制药阿苯达唑片
30334,生产厂商,天津力生制药马来酸氯苯那敏
30335,生产厂商,内蒙古天奇龙胆泻肝丸
30336,生产厂商,长征富民金山甘露醇注射液
30337,生产厂商,北京勃然妇科分清丸
30338,生产厂商,海南通用同盟鱼肝油酸钠注射
30339,生产厂商,康和枸橼酸氯米芬胶囊
30340,生产厂商,广东新峰护肝片
30341,生产厂商,珠海生化注射用复方甘草酸单
30342,生产厂商,陕西京西维生素B6注射液
30343,生产厂商,厚生药业肾石通颗粒
30344,生产厂商,递法明片
30345,生产厂商,现代制药对乙酰氨基酚栓
30346,生产厂商,万全阿仑膦酸钠片
30347,生产厂商,武田制药注射用醋酸亮丙瑞林
30348,生产厂商,吉林罗邦五子衍宗片
30349,生产厂商,吉林吉春抑亢丸
30350,生产厂商,通化金马西黄丸
30351,生产厂商,通化仁民盐酸哌甲酯片
30352,生产厂商,西安杨森复方角菜酸酯栓
30353,生产厂商,上海中西三维盐酸普罗帕酮片
30354,生产厂商,南新盐酸环丙沙星片
30355,生产厂商,白云山固肾生发丸
30356,生产厂商,新百药业肝素钠注射液
30357,生产厂商,沈阳天益堂健胃固肠散
30358,生产厂商,仙翁阿苯达唑片
30359,生产厂商,青龙香砂养胃丸
30360,生产厂商,齐鲁制药注射用甲氨蝶呤
30361,生产厂商,南京白敬宇萘普生片
30362,生产厂商,河北医大生物肌氨肽苷注射液
30363,生产厂商,康惠制药保胎无忧胶囊
30364,生产厂商,一禾药业二天油
30365,生产厂商,江西赣南氨甲环酸片
30366,生产厂商,衡山药业西咪替丁片
30367,生产厂商,星昊医药甲钴胺片
30368,生产厂商,九芝堂足光散
30369,生产厂商,圣鹰药业盐酸普罗帕酮片
30370,生产厂商,广西万通婴儿健脾散
30371,生产厂商,河南新四方金骨莲片
30372,生产厂商,吉林恒和维康眼氨肽注射液
30373,生产厂商,康亚药业盐酸洛美沙星滴眼液
30374,生产厂商,吉春制药硝酸咪康唑乳膏
30375,生产厂商,天津金耀碳酸氢钠注射液
30376,生产厂商,佛慈消痔丸
30377,生产厂商,上海通用药业醋酸氟轻松乳膏
30378,生产厂商,深圳中联仲景胃灵胶囊
30379,生产厂商,江西济民可信接骨续筋片
30380,生产厂商,裕松源药业柴胡注射液
30381,生产厂商,雷允上药业羚珠散
30382,生产厂商,一品红尿清舒颗粒
30383,生产厂商,吉林金宝麝香接骨胶囊
30384,生产厂商,午时金银花露
30385,生产厂商,盐酸乙哌立松片
30386,生产厂商,恒益药业琥乙红霉素颗粒
30387,生产厂商,震元制药碳酸氢钠注射液
30388,生产厂商,瑞阳制药阿莫西林克拉维酸钾
30389,生产厂商,长春银诺克复方胆通胶囊
30390,生产厂商,白敬宇盐酸金霉素眼膏
30391,生产厂商,天津力生制药呋塞米片
30392,生产厂商,石家庄四药复方氯化钠注射液
30393,生产厂商,德昌祥儿童回春丸
30394,生产厂商,石药集团中诺药业
30395,生产厂商,广州粤华小儿七星茶颗粒
30396,生产厂商,山东信谊吡拉西坦片
30397,生产厂商,安徽江中高邦复方醋酸地塞米
30398,生产厂商,涟水制药地塞米松磷酸钠注射
30399,生产厂商,悦康药业阿莫西林颗粒
30400,生产厂商,昆明制药蒿甲醚注射液
30401,生产厂商,南京南大注射用七叶皂苷钠
30402,生产厂商,螺内酯片
30403,生产厂商,乐家老铺参梅养胃颗粒
30404,生产厂商,联邦左福康盐酸左氧氟沙星软
30405,生产厂商,吉林敖东力源瓜霜退热灵胶囊
30406,生产厂商,恩华药业氯氮平片
30407,生产厂商,沃华医药琥珀消石颗粒
30408,生产厂商,上海通用醋酸氢化可的松注射
30409,生产厂商,远大医药氯霉素片
30410,生产厂商,黄河中药独一味软胶囊
30411,生产厂商,重庆迪康长江肌苷注射液
30412,生产厂商,奥克清
30413,生产厂商,太原药业维生素B1片
30414,生产厂商,草仙药业人工牛黄甲硝唑胶囊
30415,生产厂商,长征富民金山右旋糖酐40葡
30416,生产厂商,潇然
30417,生产厂商,维康药业益母草软胶囊
30418,生产厂商,信谊天平格列吡嗪片
30419,生产厂商,天方药业曲克芦丁片
30420,生产厂商,遂成药业癃闭舒片
30421,生产厂商,美好西林注射用盐酸甲氯芬酯
30422,生产厂商,天天明制药盐酸赛洛唑啉鼻用
30423,生产厂商,凯因科技复方甘草酸苷片
30424,生产厂商,九芝堂金鼎止血镇痛胶囊
30425,生产厂商,长治三宝复方肝浸膏片
30426,生产厂商,天津金耀黄体酮注射液
30427,生产厂商,北海阳光药业三磷酸腺苷二钠
30428,生产厂商,康斯平
30429,生产厂商,白云山何济公消炎镇痛膏
30430,生产厂商,瑞新药业薄芝片
30431,生产厂商,辰欣药业吗替麦考酚酯胶囊
